{"capture_sequence":0,"coordinate_convention":"RR-COORD-1","durability":{"image_and_metadata_durable":true,"journal_sequence":3,"network_eligible":true,"state":"network_eligible"},"encoded_from_sensor":{"layout":"row_major","math_convention":"column_vector","scalar_type":"float32","values":[1,0,0,0,1,0,0,0,1]},"frame_id":"frame_00000003-0000-4000-8000-000000000001","idempotency_key":"frameidem_00000003-0000-4000-8000-000000000001","image":{"codec":"png","color_space":"srgb","crop_in_sensor_pixels":{"height":1,"width":1,"x":0,"y":0},"height":1,"orientation":"up","payload":{"byte_length":49,"kind":"rrcap_file","relative_path":"image/frame_0001.png","sha256":"60f4ed3f4c2f93bf603f28417ab002fcfb1bd21223d3e3700d23e6da1f0dadb5"},"pixel_center":"half_integer","pixel_origin":"top_left","range":"full","width":1},"intrinsics_encoded_pixels":{"cx":0.5,"cy":0.5,"fx":1,"fy":1,"height":1,"units":"encoded_pixels","width":1},"monotonic_timestamp_ns":"1000003003","payload_sha256":"60f4ed3f4c2f93bf603f28417ab002fcfb1bd21223d3e3700d23e6da1f0dadb5","previous_durable_frame_id":null,"protocol_version":"1.0.0","quality":{"blur_score":0.25,"exposure_score":0.5,"motion_score":0.125,"selected_reason":"cadence"},"session_id":"session_00000003-0000-4000-8000-000000000001","submap_id":"submap_00000003-0000-4000-8000-000000000001","timestamp_domain":"device_monotonic_boot","tracking":{"reason":"none","state":"normal"},"wire_framing":{"byte_order":"network_big_endian","fixed_header_bytes":24,"format":"RRFP-WIRE-1","json_encoding":"rfc8785_jcs_utf8","json_header_max_bytes":65536,"magic_ascii":"RRFP","payload_max_bytes":16777216,"version_major":1,"version_minor":0},"world_frame_id":"world_00000003-0000-4000-8000-000000000001","world_frame_version":1,"world_from_camera":{"layout":"row_major","math_convention":"column_vector","scalar_type":"float32","units":"meters","values":[1,0,0,0.125,0,1,0,0.25,0,0,1,-0.5,0,0,0,1]}}