{"protocol_version":"1.0.0","session_id":"session_00000000-0000-4000-8000-000000000001","submap_id":"submap_00000000-0000-4000-8000-000000000001","frame_id":"frame_00000000-0000-4000-8000-000000000001","world_frame_id":"world_00000000-0000-4000-8000-000000000001","world_frame_version":1,"capture_sequence":0,"monotonic_timestamp_ns":"9007199254740993","timestamp_domain":"device_monotonic_boot","coordinate_convention":"RR-COORD-1","image":{"codec":"jpeg","width":640,"height":480,"orientation":"up","pixel_origin":"top_left","pixel_center":"half_integer","color_space":"srgb","range":"full","crop_in_sensor_pixels":{"x":0,"y":0,"width":640,"height":480},"payload":{"kind":"inline_binary_after_json","byte_length":4}},"intrinsics_encoded_pixels":{"fx":500,"fy":500,"cx":319.5,"cy":239.5,"width":640,"height":480,"units":"encoded_pixels"},"encoded_from_sensor":{"layout":"row_major","scalar_type":"float32","math_convention":"column_vector","values":[1,0,0,0,1,0,0,0,1]},"world_from_camera":{"layout":"row_major","scalar_type":"float32","math_convention":"column_vector","units":"meters","values":[1,0,0,0,0,1,0,0,0,0,1,0,0,0,0,1]},"tracking":{"state":"normal","reason":"none"},"quality":{"motion_score":0,"blur_score":1,"exposure_score":1,"selected_reason":"cadence"},"durability":{"state":"network_eligible","image_and_metadata_durable":true,"journal_sequence":0,"network_eligible":true},"idempotency_key":"frameidem_00000000-0000-4000-8000-000000000001","previous_durable_frame_id":null,"payload_sha256":"9f86d081884c7d659a2feaa0c55ad015a3bf4f1b2b0b822cd15d6c15b0f00a08","wire_framing":{"format":"RRFP-WIRE-1","magic_ascii":"RRFP","version_major":1,"version_minor":0,"byte_order":"network_big_endian","fixed_header_bytes":24,"json_encoding":"rfc8785_jcs_utf8","json_header_max_bytes":65536,"payload_max_bytes":16777216}}
